{"schema_version":1,"event_id":"obs-02","observed_at":"2026-10-05T00:00:00Z","adapter_id":"synthetic_external","adapter_version":"2.0","source":{"kind":"other","native_event_name":"usage_sample","replay_key":"source-position-7"},"capability_snapshot_id":"synthetic-external-a","identity":{"envelope_version":1,"observed_at":"2026-10-05T00:00:00Z","host_id":"opaque-host","tool_provider":"synthetic_host","lineage_status":"child","agent_id":"opaque-agent","parent_agent_id":"opaque-parent"},"scope":"agent","kind":"usage","facts":{"measure":"input_tokens","amount":42,"unit":"token","aggregation":"delta","observation_scope":"agent"},"quality":"reconstructed","field_provenance":{"facts.amount":"synthetic-test-input"}}
