{"schema_version":1,"event_id":"obs-01","observed_at":"2026-10-05T00:00:00Z","adapter_id":"codex","adapter_version":"0.1.0","host_version":"0.160.0","source":{"kind":"hook","native_event_name":"PreToolUse","native_schema_ref":"synthetic://codex/PreToolUse"},"capability_snapshot_id":"synthetic-codex-a","identity":{"envelope_version":1,"observed_at":"2026-10-05T00:00:00Z","host_id":"opaque-host","tool_provider":"codex","lineage_status":"unknown"},"scope":"unknown","kind":"tool_before","facts":{"tool_name":"shell","action_kind":"unknown","operand_completeness":"unknown"},"quality":"literal","field_provenance":{"facts.tool_name":"synthetic-schema-example"}}
