{"schema_version":1,"event_id":"obs-record-only","observed_at":"2026-10-05T00:00:00Z","adapter_id":"codex","adapter_version":"0.1.0","source":{"kind":"hook","native_event_name":"PreToolUse"},"capability_snapshot_id":"synthetic-codex-a","identity":{"envelope_version":1,"observed_at":"2026-10-05T00:00:00Z","host_id":"opaque-host","tool_provider":"codex","lineage_status":"unknown"},"scope":"unknown","kind":"tool_before","facts":{"tool_name":"Bash"},"quality":"literal","field_provenance":{"facts.tool_name":"synthetic-native-name"}}
